{
  "$schema": "https://json-schema.org/draft/2020-12/schema",
  "$id": "urn:agentle:jitai-proposal:v1",
  "title": "JitaiProposalSchema v1",
  "type": "object",
  "additionalProperties": false,
  "required": ["schemaVersion", "status", "unsupported", "questions", "assumptions", "jitai"],
  "properties": {
    "schemaVersion": { "const": 1 },
    "status": { "enum": ["OK", "NEEDS_CLARIFICATION", "UNSUPPORTED"] },
    "unsupported": { "anyOf": [{ "type": "null" }, { "$ref": "#/$defs/unsupported" }] },
    "questions": { "type": "array", "maxItems": 3, "items": { "$ref": "#/$defs/question" } },
    "assumptions": { "type": "array", "maxItems": 5, "items": { "$ref": "#/$defs/assumption" } },
    "jitai": { "anyOf": [{ "type": "null" }, { "$ref": "#/$defs/draft" }] }
  },
  "$defs": {
    "hhmm": { "type": "string", "pattern": "^([01][0-9]|2[0-3]):[0-5][0-9]$" },
    "jitaiCategory": { "enum": ["PHYSICAL_ACTIVITY", "SLEEP_WIND_DOWN", "DIGITAL_WELLBEING", "STRESS_BREAK", "GENERAL"] },
    "unsupported": {
      "type": "object", "additionalProperties": false, "required": ["reason", "detail"],
      "properties": {
        "reason": { "enum": ["NEEDS_UNAVAILABLE_DATA", "NEEDS_FINER_TIMING", "NEEDS_UNAVAILABLE_ACTION", "NOT_A_REMINDER", "HEALTH_OR_SAFETY", "OTHER"] },
        "detail": { "type": ["string", "null"], "maxLength": 200 }
      }
    },
    "question": {
      "type": "object", "additionalProperties": false, "required": ["id", "text", "options"],
      "properties": {
        "id": { "enum": ["q1", "q2", "q3"] },
        "text": { "type": "string", "minLength": 1, "maxLength": 200 },
        "options": { "type": "array", "minItems": 2, "maxItems": 4, "items": { "type": "string", "minLength": 1, "maxLength": 60 } }
      }
    },
    "assumption": {
      "type": "object", "additionalProperties": false, "required": ["path", "text"],
      "properties": {
        "path": { "type": "string", "pattern": "^/jitai(/[A-Za-z0-9_]+)*$", "maxLength": 200 },
        "text": { "type": "string", "minLength": 1, "maxLength": 200 }
      }
    },
    "draft": {
      "type": "object", "additionalProperties": false,
      "required": ["name", "description", "kind", "category", "trigger", "activeWindow", "conditions", "contextRequirements",
                   "delivery", "content", "cooldownMinutes", "maxPerDay", "maxPerWeek", "priority", "snooze", "expiresInDays",
                   "outcome", "suppression"],
      "properties": {
        "name": { "type": "string", "minLength": 1, "maxLength": 60 },
        "description": { "type": "string", "minLength": 1, "maxLength": 280 },
        "kind": { "enum": ["INTERVENTION", "SUPPRESSION"] },
        "category": { "$ref": "#/$defs/jitaiCategory" },
        "trigger": { "anyOf": [{ "type": "null" }, { "$ref": "#/$defs/trigger" }] },
        "activeWindow": { "anyOf": [{ "type": "null" }, { "$ref": "#/$defs/window" }] },
        "conditions": { "anyOf": [{ "type": "null" }, { "$ref": "#/$defs/condition" }] },
        "contextRequirements": { "anyOf": [{ "type": "null" }, { "$ref": "#/$defs/condition" }] },
        "delivery": { "$ref": "#/$defs/delivery" },
        "content": { "anyOf": [{ "type": "null" }, { "$ref": "#/$defs/content" }] },
        "cooldownMinutes": { "type": ["integer", "null"], "minimum": 60, "maximum": 10080 },
        "maxPerDay": { "type": ["integer", "null"], "minimum": 1, "maximum": 3 },
        "maxPerWeek": { "type": ["integer", "null"], "minimum": 1, "maximum": 14 },
        "priority": { "type": "integer", "minimum": 0, "maximum": 60 },
        "snooze": { "anyOf": [{ "type": "null" }, { "$ref": "#/$defs/snooze" }] },
        "expiresInDays": { "type": ["integer", "null"], "minimum": 1, "maximum": 90 },
        "outcome": { "anyOf": [{ "type": "null" }, { "$ref": "#/$defs/outcome" }] },
        "suppression": { "anyOf": [{ "type": "null" }, { "$ref": "#/$defs/suppression" }] }
      }
    },
    "trigger": {
      "anyOf": [
        { "type": "object", "additionalProperties": false, "required": ["type", "events", "debounceSeconds"],
          "properties": {
            "type": { "const": "event" },
            "events": { "type": "array", "minItems": 1, "maxItems": 8, "uniqueItems": true, "items": { "$ref": "#/$defs/eventType" } },
            "debounceSeconds": { "type": "integer", "minimum": 0, "maximum": 600 } } },
        { "type": "object", "additionalProperties": false, "required": ["type", "everyMinutes"],
          "properties": {
            "type": { "const": "interval" },
            "everyMinutes": { "type": "integer", "minimum": 30, "maximum": 1440, "multipleOf": 15 } } },
        { "type": "object", "additionalProperties": false, "required": ["type", "times", "maxLatenessMinutes"],
          "properties": {
            "type": { "const": "daily_at" },
            "times": { "type": "array", "minItems": 1, "maxItems": 6, "uniqueItems": true, "items": { "$ref": "#/$defs/hhmm" } },
            "maxLatenessMinutes": { "type": "integer", "minimum": 5, "maximum": 120 } } }
      ]
    },
    "eventType": { "enum": ["ACTIVITY_STATE_CHANGED", "HEALTH_SYNC_COMPLETED", "SLEEP_SESSION_AVAILABLE",
                            "NOTIFICATION_POSTED", "POWER_CONNECTED", "POWER_DISCONNECTED", "SCREEN_INTERACTIVE", "USER_PRESENT"] },
    "window": {
      "type": "object", "additionalProperties": false, "required": ["start", "end", "days"],
      "properties": {
        "start": { "$ref": "#/$defs/hhmm" },
        "end": { "$ref": "#/$defs/hhmm" },
        "days": { "anyOf": [{ "type": "null" },
                            { "type": "array", "minItems": 1, "maxItems": 7, "uniqueItems": true,
                              "items": { "enum": ["MON", "TUE", "WED", "THU", "FRI", "SAT", "SUN"] } }] }
      }
    },
    "condition": {
      "anyOf": [
        { "$ref": "#/$defs/group" }, { "$ref": "#/$defs/not" }, { "$ref": "#/$defs/compare" },
        { "$ref": "#/$defs/between" }, { "$ref": "#/$defs/in" }, { "$ref": "#/$defs/timeWindow" }
      ]
    },
    "group": {
      "type": "object", "additionalProperties": false, "required": ["type", "of"],
      "properties": {
        "type": { "enum": ["all", "any"] },
        "of": { "type": "array", "minItems": 1, "maxItems": 8, "items": { "$ref": "#/$defs/condition" } }
      }
    },
    "not": {
      "type": "object", "additionalProperties": false, "required": ["type", "of"],
      "properties": { "type": { "const": "not" }, "of": { "$ref": "#/$defs/condition" } }
    },
    "compare": {
      "type": "object", "additionalProperties": false, "required": ["type", "feature", "args", "value", "onUnknown"],
      "properties": {
        "type": { "enum": ["gt", "gte", "lt", "lte", "eq", "neq"] },
        "feature": { "$ref": "#/$defs/featureId" },
        "args": { "$ref": "#/$defs/args" },
        "value": { "$ref": "#/$defs/literal" },
        "onUnknown": { "$ref": "#/$defs/onUnknown" }
      }
    },
    "between": {
      "type": "object", "additionalProperties": false, "required": ["type", "feature", "args", "min", "max", "onUnknown"],
      "properties": {
        "type": { "const": "between" },
        "feature": { "$ref": "#/$defs/featureId" },
        "args": { "$ref": "#/$defs/args" },
        "min": { "$ref": "#/$defs/literal" },
        "max": { "$ref": "#/$defs/literal" },
        "onUnknown": { "$ref": "#/$defs/onUnknown" }
      }
    },
    "in": {
      "type": "object", "additionalProperties": false, "required": ["type", "feature", "args", "values", "onUnknown"],
      "properties": {
        "type": { "const": "in" },
        "feature": { "$ref": "#/$defs/featureId" },
        "args": { "$ref": "#/$defs/args" },
        "values": { "type": "array", "minItems": 1, "maxItems": 10, "uniqueItems": true, "items": { "$ref": "#/$defs/literal" } },
        "onUnknown": { "$ref": "#/$defs/onUnknown" }
      }
    },
    "timeWindow": {
      "type": "object", "additionalProperties": false, "required": ["type", "start", "end"],
      "properties": { "type": { "const": "local_time_in" }, "start": { "$ref": "#/$defs/hhmm" }, "end": { "$ref": "#/$defs/hhmm" } }
    },
    "literal": { "type": ["integer", "string", "boolean"] },
    "onUnknown": { "enum": [null, "ASSUME_TRUE", "ASSUME_FALSE"] },
    "featureId": {
      "enum": ["local_time", "day_of_week", "day_type", "engine_day_of_week",
               "charging", "battery_pct", "device_interactive", "dnd_active", "in_call", "headphones_connected",
               "screen_minutes_last_60m", "screen_minutes_since", "app_minutes_last_60m", "app_minutes_since",
               "app_category_minutes_last_60m", "app_category_minutes_since", "app_opens_last_60m", "foreground_app",
               "notifications_last_60m", "activity_state", "activity_level_last_30m",
               "steps_today", "steps_last_60m", "steps_last_30m",
               "sleep_minutes_last_night", "bedtime_last_night", "wake_time_today",
               "resting_hr_today", "resting_hr_delta_vs_28d",
               "minutes_since_last_delivery", "deliveries_today", "deliveries_last_7d", "last_response", "consecutive_ignored"]
    },
    "args": {
      "type": "object", "additionalProperties": false, "required": ["package", "appLabel", "category", "since", "jitai"],
      "properties": {
        "package": { "type": ["string", "null"], "maxLength": 255 },
        "appLabel": { "type": ["string", "null"], "minLength": 1, "maxLength": 60 },
        "category": { "enum": [null, "SOCIAL", "VIDEO", "GAME", "AUDIO", "NEWS", "IMAGE", "MAPS", "PRODUCTIVITY", "ACCESSIBILITY", "UNDEFINED"] },
        "since": { "anyOf": [{ "type": "null" }, { "$ref": "#/$defs/hhmm" }] },
        "jitai": { "type": ["string", "null"],
                   "pattern": "^(self|any|category:(PHYSICAL_ACTIVITY|SLEEP_WIND_DOWN|DIGITAL_WELLBEING|STRESS_BREAK|GENERAL))$" }
      }
    },
    "delivery": {
      "type": "object", "additionalProperties": false, "required": ["channel", "quietHoursPolicy", "notificationTimeoutMinutes"],
      "properties": {
        "channel": { "enum": ["NOTIFICATION", "IMAGE", "VOICE", "VIDEO", "NONE"] },
        "quietHoursPolicy": { "enum": ["RESPECT", "ALLOW_WHEN_INTERACTIVE"] },
        "notificationTimeoutMinutes": { "type": ["integer", "null"], "minimum": 5, "maximum": 1440 }
      }
    },
    "textPair": {
      "type": "object", "additionalProperties": false, "required": ["title", "body"],
      "properties": {
        "title": { "type": "string", "minLength": 1, "maxLength": 60 },
        "body": { "type": "string", "minLength": 1, "maxLength": 240 }
      }
    },
    "template": {
      "type": "object", "additionalProperties": false, "required": ["type", "title", "body"],
      "properties": {
        "type": { "const": "template" },
        "title": { "type": "string", "minLength": 1, "maxLength": 60 },
        "body": { "type": "string", "minLength": 1, "maxLength": 240 }
      }
    },
    "content": {
      "anyOf": [
        { "type": "object", "additionalProperties": false, "required": ["type", "title", "body"],
          "properties": { "type": { "const": "static" },
                          "title": { "type": "string", "minLength": 1, "maxLength": 60 },
                          "body": { "type": "string", "minLength": 1, "maxLength": 240 } } },
        { "$ref": "#/$defs/template" },
        { "type": "object", "additionalProperties": false, "required": ["type", "items", "selection"],
          "properties": { "type": { "const": "variants" },
                          "items": { "type": "array", "minItems": 2, "maxItems": 8, "items": { "$ref": "#/$defs/textPair" } },
                          "selection": { "const": "ROTATE" } } },
        { "type": "object", "additionalProperties": false, "required": ["type", "goal", "tone", "fallback"],
          "properties": { "type": { "const": "ai_text" },
                          "goal": { "type": "string", "minLength": 1, "maxLength": 200 },
                          "tone": { "enum": ["WARM", "NEUTRAL", "BRIEF"] },
                          "fallback": { "$ref": "#/$defs/template" } } },
        { "type": "object", "additionalProperties": false, "required": ["type", "assetId", "caption"],
          "properties": { "type": { "const": "local_media" },
                          "assetId": { "type": "string", "pattern": "^[a-z0-9_]{1,40}$" },
                          "caption": { "$ref": "#/$defs/template" } } }
      ]
    },
    "snooze": {
      "type": "object", "additionalProperties": false, "required": ["mode", "options"],
      "properties": {
        "mode": { "enum": ["SUPPRESS_ONLY", "RE_EVALUATE_AFTER"] },
        "options": { "type": "array", "minItems": 1, "maxItems": 3, "uniqueItems": true,
                     "items": { "enum": ["MINUTES_30", "MINUTES_60", "MINUTES_120", "UNTIL_WINDOW_END", "UNTIL_TOMORROW"] } }
      }
    },
    "metricRef": {
      "type": "object", "additionalProperties": false, "required": ["metric", "args", "windowMinutes"],
      "properties": {
        "metric": { "enum": ["STEPS_AFTER", "SCREEN_MINUTES_AFTER", "APP_MINUTES_AFTER", "APP_CATEGORY_MINUTES_AFTER",
                             "NOTIFICATION_OPENED", "SELF_REPORT_HELPFUL", "BEDTIME_NEXT", "SLEEP_MINUTES_NEXT", "STEPS_DAY_TOTAL"] },
        "args": { "$ref": "#/$defs/args" },
        "windowMinutes": { "type": ["integer", "null"], "minimum": 5, "maximum": 240 }
      }
    },
    "outcome": {
      "type": "object", "additionalProperties": false, "required": ["proximal", "distal"],
      "properties": {
        "proximal": { "$ref": "#/$defs/metricRef" },
        "distal": { "anyOf": [{ "type": "null" }, { "$ref": "#/$defs/metricRef" }] }
      }
    },
    "suppression": {
      "type": "object", "additionalProperties": false, "required": ["categories"],
      "properties": {
        "categories": { "type": "array", "minItems": 1, "maxItems": 5, "uniqueItems": true, "items": { "$ref": "#/$defs/jitaiCategory" } }
      }
    }
  }
}

